{
  "review_type": "scientific",
  "book": "slug-del-libro",
  "status": "pass_with_changes",
  "checked": [
    "capítulo 1",
    "ecuaciones 1.1-1.8"
  ],
  "findings": [
    {
      "severity": "warning",
      "claim_or_location": "capítulo 1, sección 1.3",
      "issue": "Describe aquí el problema detectado.",
      "evidence": "SRC-001 / derivación / referencia",
      "action": "Cambio concreto requerido."
    }
  ]
}
